{
  "$schema": "../room.schema.json",
  "id": "b01",
  "chapter": "c6",
  "title": "Form Kapısı",
  "theme": "surface",
  "width": 2600,
  "spawn": {
    "x": 240,
    "facing": 1
  },
  "form": "root",
  "enter": [
    {
      "say": [
        {
          "text": "Boş bir oda. Bir kapı, bir de biri."
        }
      ]
    }
  ],
  "props": [
    {
      "key": "prop.tree",
      "x": 620,
      "depth": -25
    },
    {
      "key": "prop.bush",
      "x": 1080
    },
    {
      "key": "prop.tree",
      "x": 2050,
      "depth": -25,
      "flip": true
    }
  ],
  "npcs": [
    {
      "id": "ayBasli",
      "who": "moonMan",
      "x": 900,
      "facing": -1,
      "talk": [
        {
          "who": "moonMan",
          "text": "Kök hâlinle o kapıdan geçemezsin."
        },
        {
          "who": "gorti",
          "text": "Peki ne yapmalıyım?"
        },
        {
          "who": "moonMan",
          "text": "İnsana dönüşmelisin. Biçimini değiştirmek için R’ye bas."
        }
      ],
      "again": [
        {
          "who": "moonMan",
          "text": "R’ye bas, insan ol. Bu kapı yalnızca insanlara açılır."
        }
      ],
      "then": [
        {
          "unlock": "form"
        }
      ]
    }
  ],
  "gates": [
    {
      "id": "kapi",
      "x": 1500,
      "open": "form:human",
      "look": "wood",
      "hint": "Bu kapı yalnızca insanlara açılır. (R)"
    }
  ],
  "triggers": [
    {
      "id": "gecti",
      "x": 1800,
      "do": [
        {
          "word": "OLDU!"
        },
        {
          "sky": {
            "sun": "laugh"
          }
        },
        {
          "flag": "b01.passed"
        }
      ]
    }
  ],
  "exits": [
    {
      "to": "b02",
      "when": "b01.passed"
    }
  ]
}
